{
  "schema_version": "v1",
  "candidate_key": "momentum_v2",
  "backtest_identity": {
    "fidelity_id": "high",
    "cost_model_id": "fixed_2bps",
    "scenario_id": "bull_market",
    "data_slice_id": "2020-2023"
  },
  "hash_set": {
    "intent_hash": "sha256:a1b2c3d4e5f6a1b2c3d4e5f6a1b2c3d4e5f6a1b2c3d4e5f6a1b2c3d4e5f6a1b2",
    "plan_hash": "sha256:b2c3d4e5f6a1b2c3d4e5f6a1b2c3d4e5f6a1b2c3d4e5f6a1b2c3d4e5f6a1b2c3"
  }
}
